230,114841000,Фрунзенский,Масюковщина,1,Долгосрочная,2,36 м²,8 м²,Раздельный,Есть,"Мебель, Телевизор",,"Газовая плита, Холодильник",,Месяц,5,9,Панельный,1979,"В парк, Восток","Лифт, Мусоропровод",Вторичное жилье,"Ольшевского ул, Минск",250 $ *,18 м²,,Косметический,,,,,,,,
231,110617559,Советский,,1,Долгосрочная,1,36 м²,8 м²,Раздельный,Лоджия,"Wi-Fi, Телефон, Мебель",Стиральная машина,"Холодильник, Электрическая плита","Студентам, Парам, С детьми",Залог,8,9,Панельный,,Во двор,"Лифт, Мусоропровод, Домофон",Вторичное жилье,"Некрасова ул, 35к2, Минск",300 $ *,,-,Косметический,-,,-,,-,-,,
232,114829572,Фрунзенский,Раковское шоссе,1,Долгосрочная,2,,,Совмещенный,Нет,"Мебель, Телевизор, Wi-Fi",,"Посуда/столовые приборы, Газовая плита, СВЧ-печь, Холодильник",,,5,5,Кирпичный,,,,Вторичное жилье,"Ольшевского ул, 17, Минск",250 $ *,,,Косметический,,Пушкинская,,,,,,
233,114825993,Октябрьский,Курасовщина,1,Долгосрочная,,35 м²,7.5 м²,Раздельный,Нет,,,,,,3,5,Панельный,1976,,,Вторичное жилье,"Казинца ул, 68, Минск",220 $ *,17.8 м²,,,,,,,,,,
234,114817000,Первомайский,Восточный,1,Долгосрочная,2,43 м²,10 м²,Раздельный,Лоджия,"Телефон, Мебель, Телевизор",Стиральная машина,"Электрическая плита, Посуда/столовые приборы, Холодильник",Рабочим,Месяц,6,19,Панельный,2012,Во двор,,Вторичное жилье,"Героев 120-й Дивизии ул, 19, Минск",300 $ *,18 м²,,Евро,,,,,,,,
235,114797441,Октябрьский,Серова,1,Долгосрочная,,49.7 м²,9 м²,Раздельный,Лоджия,"Телефон, Wi-Fi",Стиральная машина,"Электрическая плита, Посуда/столовые приборы, Холодильник",,2 месяца,2,13,Кирпичный,1998,Во двор,"Лифт, Мусоропровод, Домофон",Вторичное жилье,"Лейтенанта Кижеватова ул, 7к2, Минск",270 $ *,,,Косметический,,,,,,,,
236,114793832,Заводской,Северный поселок,1,Долгосрочная,2,40 м²,10 м²,Раздельный,Есть,"Wi-Fi, Телефон, Мебель, Телевизор",Стиральная машина,"Посуда/столовые приборы, СВЧ-печь, Электрическая плита, Холодильник",,2 месяца,5,9,Блочный,2000,В парк,"Лифт, Мусоропровод, Стояночное место, Домофон",Вторичное жилье,"Пожарского ул, 9, Северный посёлок, Заводской район, Минск",200 $ *,28 м²,,Косметический,,,,,,,,
237,107828250,Фрунзенский,Сухарево,1,Долгосрочная,2,,6 м²,Раздельный,Есть,"Wi-Fi, Телевизор, Мебель, Телефон",Стиральная машина,"Холодильник, СВЧ-печь, Электрическая плита",Парам,2 месяца,10,14,Панельный,2007,На улицу,,Вторичное жилье,"Лобанка ул, 75, Минск",317 $ *,18 м²,,Косметический,,,,-,,,,
238,114747277,Советский,Комаровка,1,Долгосрочная,,35 м²,7 м²,Раздельный,Лоджия,"Мебель, Телефон",Стиральная машина,"Холодильник, Газовая плита, Посуда/столовые приборы",,,2,9,Кирпичный,1980,Во двор,,Вторичное жилье,"мкр. Комаровка, Минск",250 $ *,19 м²,,Косметический,,Площадь Якуба Коласа,,,,,,
239,114742750,,,1,Долгосрочная,,54 м²,11.9 м²,Раздельный,Лоджия,"Телефон, Мебель, Wi-Fi",Стиральная машина,Газовая плита,,Месяц,1,5,Панельный,2004,Во двор,"Домофон, Стояночное место",Вторичное жилье,"Полевая ул, 3А, посёлок Юбилейный, Сеницкий сельсовет, Минский район, Минская область",229 $ *,17.7 м²,,Косметический,,,,,,,,
240,114738367,Советский,,1,Долгосрочная,,33 м²,6 м²,Совмещенный,Нет,Мебель,"Комплект полотенец, Стиральная машина","Электрическая плита, Посуда/столовые приборы, Холодильник","Рабочим, Парам",Месяц,5,5,,,Во двор,Домофон,Новое,"Якуба Коласа ул, 29, Минск",370 $ *,22 м²,Да,Евро,,Академия наук,,,,,,
241,114734109,Заводской,,1,Долгосрочная,,42.5 м²,9.2 м²,Совмещенный,Есть,,,,,,11,19,Панельный,2010,,,Новое,"Одесская ул, 6, Минск",230 $ *,18 м²,,,,Автозаводская,,,,,,
242,114731454,Центральный,,1,Долгосрочная,1,,,Совмещенный,Есть,"Кондиционер, Телевизор, Мебель, Wi-Fi",,"Газовая плита, Холодильник",,,5,5,Кирпичный,,Во двор,,Вторичное жилье,"Лилии Карастояновой ул, 13, Минск",230 $ *,,,,,,,,,,,
243,114723553,Фрунзенский,Каскад,1,Долгосрочная,,43.6 м²,12.3 м²,Совмещенный,Лоджия,,,,,,2,9,Панельный,,,,Новое,"Скрыганова ул, 4Д, Минск",600 $ *,20.2 м²,,,,Молодежная,,,,,,
244,114716642,Центральный,,1,Долгосрочная,2,42 м²,,,Лоджия,"Wi-Fi, Телевизор, Телефон, Мебель",,"Электрическая плита, Посуда/столовые приборы, СВЧ-печь, Холодильник",,,,,Каркасно-блочный,2016,,"Лифт, Пандус, Огороженная территория, Домофон",Новое,"Ржавецкая ул, 5, Минск",380 $ *,,Да,Евро,,,,,,,,
245,114698083,Заводской,,1,Долгосрочная,,30 м²,7 м²,Совмещенный,Есть,,,Газовая плита,,,3,5,Кирпичный,1968,,Домофон,Вторичное жилье,"Народная ул, 26к2, Минск",200 $ *,18 м²,,Косметический,,Партизанская,,,,Да,,
246,111585157,Московский,Малиновка,1,Долгосрочная,1,34 м²,7.5 м²,Раздельный,Лоджия,"Wi-Fi, Телефон, Мебель",Стиральная машина,"Холодильник, Электрическая плита",Парам,Месяц,8,9,Панельный,,Во двор,"Мусоропровод, Лифт",Вторичное жилье,"Рафиева ул, 78, Минск",220 $ *,18 м²,,Косметический,,,,,,,,
247,114683409,Фрунзенский,,1,Долгосрочная,2,32 м²,8 м²,Раздельный,Есть,"Телефон, Мебель",Стиральная машина,"Холодильник, Газовая плита",Парам,2 месяца,8,9,Панельный,,,"Лифт, Мусоропровод, Домофон",Вторичное жилье,"Болеслава Берута ул, Минск",250 $ *,18 м²,-,Косметический,-,Пушкинская,-,-,-,-,,
248,114676165,Ленинский,,1,Долгосрочная,3,33 м²,,Раздельный,Лоджия,"Телефон, Мебель",Стиральная машина,"Холодильник, Газовая плита",,Месяц,8,9,Кирпичный,,Во двор,"Лифт, Мусоропровод",Вторичное жилье,"Козыревская ул, 4, Минск",250 $ *,19 м²,-,Косметический,-,,-,-,-,-,,
249,114654718,Первомайский,Восток,1,Долгосрочная,1,38 м²,9 м²,Раздельный,Лоджия,"Wi-Fi, Мебель, Телефон",,"Холодильник, Электрическая плита",,Месяц,4,16,,1976,"Во двор, Запад","Лифт, Пандус, Домофон",Вторичное жилье,"Калиновского ул, 82к2, Минск",230 $ *,18 м²,,Косметический,,Восток,,-,,,,
250,114662393,Фрунзенский,Масюковщина,1,Долгосрочная,,39 м²,5.5 м²,Совмещенный,Есть,"Wi-Fi, Телевизор, Телефон, Утюг, Мебель",Стиральная машина,"Холодильник, СВЧ-печь, Кофеварка, Газовая плита",,Месяц,3,5,Кирпичный,,Во двор,Домофон,Вторичное жилье,"Чигладзе ул, 6к2, мкр. Масюковщина-1, Минск",300 $ *,17 м²,-,Косметический,-,,-,-,-,-,,
251,114654583,Фрунзенский,Масюковщина,1,Долгосрочная,,40.1 м²,9 м²,Раздельный,,,,,,,8,9,Панельный,2011,,,Новое,"Михася Лынькова ул, 99В, Минск",340 $ *,17.9 м²,,,,,,,,,,
252,114651862,Московский,,1,Долгосрочная,2,37 м²,9 м²,Раздельный,Есть,"Wi-Fi, Телевизор, Утюг, Мебель","Стиральная машина, Комплект полотенец, Фен","Холодильник, СВЧ-печь, Посуда/столовые приборы, Электрическая плита","Студентам, С детьми, Парам, Рабочим, Командировочным",Нет,3,5,Кирпичный,1963,Во двор,Стояночное место,Вторичное жилье,"Коллекторная ул, 32, Минск",233 $ *,16 м²,-,Евро,-,Фрунзенская,-,-,-,-,,
253,114643932,Октябрьский,Курасовщина,1,Долгосрочная,2,,,Раздельный,Есть,"Телевизор, Телефон, Мебель",Стиральная машина,"Холодильник, Газовая плита","Студентам, Парам",Месяц,1,9,Блочный,,Во двор,"Лифт, Мусоропровод, Домофон",Вторичное жилье,"Казинца ул, 70, Минск",250 $ *,,-,Косметический,-,,-,-,-,-,,
254,113883212,Советский,Зеленый луг,1,Долгосрочная,2,38 м²,8 м²,Раздельный,Лоджия,"Wi-Fi, Телевизор, Мебель, Телефон, Утюг","Стиральная машина, Комплект полотенец","Холодильник, СВЧ-печь, Посуда/столовые приборы, Газовая плита",Парам,Залог,6,9,,,,"Лифт, Мусоропровод, Домофон",Вторичное жилье,"Мирошниченко ул, 12, Минск",260 $ *,18 м²,,Косметический,,,,,,,,
255,114628834,Центральный,Лебяжий,1,Долгосрочная,,38.3 м²,,Совмещенный,Лоджия,,,,,,10,22,Панельный,2014,,,Новое,"Мястровская ул, 4, Минск",420 $ *,33.6 м²,,Евро,,,,,,,,
256,107240195,Центральный,,1,Долгосрочная,2,45 м²,7 м²,Раздельный,Есть,"Wi-Fi, Телевизор, Телефон, Утюг, Мебель","Душевая кабина, Стиральная машина, Комплект полотенец, Фен","Холодильник, СВЧ-печь, Посуда/столовые приборы, Газовая плита",,Месяц,4,5,Кирпичный,,"На улицу, Юг, В парк","Лифт, Домофон",Вторичное жилье,"Ленина ул, 5, Минск",530 $ *,17 м²,,Дизайнерский,,Октябрьская (Купаловская),,,,,,
257,114621289,Фрунзенский,Каскад,1,Долгосрочная,,51.9 м²,14 м²,Совмещенный,Лоджия,"Wi-Fi, Телевизор, Мебель",,"Холодильник, СВЧ-печь, Электрическая плита",,2 месяца,4,10,Монолитный,2011,Во двор,"Лифт, Огороженная территория, Домофон, Видеонаблюдение",Вторичное жилье,"Скрыганова ул, 2, Минск",350 $ *,20 м²,,Евро,,Молодежная,,,,,,
258,114621277,Первомайский,,1,Долгосрочная,,46.7 м²,,Совмещенный,,,,,,,14,20,,,,,Новое,"Петра Мстиславца ул, 8, Минск",490 $ *,42.2 м²,,,,Восток,,,,,,
259,114613938,Заводской,,1,Долгосрочная,,34 м²,7 м²,Совмещенный,Нет,"Wi-Fi, Телевизор, Телефон, Утюг, Мебель","Душевая кабина, Стиральная машина","Холодильник, СВЧ-печь, Посуда/столовые приборы, Газовая плита",,,1,4,Кирпичный,,Во двор,,Вторичное жилье,"Партизанский пр, 116, Минск",360 $ *,20 м²,,Евро,,Автозаводская,,,,,,
260,108792170,Советский,Зеленый луг,1,Долгосрочная,,,,Раздельный,Есть,,,Газовая плита,С детьми,Месяц,2,9,Панельный,,Во двор,,Вторичное жилье,"Широкая ул, 38к4, Минск",200 $ *,,,Косметический,,,,,,Да,,
261,114577491,Октябрьский,,1,Долгосрочная,,,,Совмещенный,Есть,"Wi-Fi, Телевизор, Телефон, Мебель","Душевая кабина, Стиральная машина","Холодильник, Электрическая плита",,,3,,,,,,Вторичное жилье,"Аэродромная ул, 32, Минск",350 $ *,,,Евро,,,,,,,,
262,114568353,Московский,,1,Долгосрочная,2,48 м²,12 м²,Совмещенный,Лоджия,"Wi-Fi, Телевизор, Утюг, Мебель",Стиральная машина,"Холодильник, СВЧ-печь, Посудомоечная машина, Посуда/столовые приборы, Электрическая плита",Парам,2 месяца,6,22,Монолитный,2016,На улицу,"Лифт, Домофон, Видеонаблюдение",Вторичное жилье,"Дзержинского пр, 22, Минск",430 $ *,17 м²,,Косметический,,Грушевка,,,Да,,,
263,114559346,Первомайский,,1,Долгосрочная,2,36 м²,,Совмещенный,Нет,"Мебель, Телефон, Утюг",Стиральная машина,"Холодильник, Посуда/столовые приборы, Газовая плита",Парам,Месяц,2,5,Кирпичный,,Во двор,,Вторичное жилье,"Независимости пр, 78, Минск",370 $ *,,Да,Евро,,Академия наук,,,,,,
264,114551727,Фрунзенский,,1,Долгосрочная,1,38.4 м²,8.3 м²,Раздельный,Есть,Мебель,Стиральная машина,"Холодильник, Газовая плита",,,7,9,Панельный,,На улицу,,Вторичное жилье,"Пушкина пр, 33, Минск",300 $ *,17.3 м²,-,,-,Пушкинская,-,-,-,-,,
265,114550583,Московский,Малиновка,1,Долгосрочная,4,36 м²,7.2 м²,Раздельный,Есть,"Wi-Fi, Телевизор, Телефон, Утюг, Мебель","Стиральная машина, Фен","Холодильник, СВЧ-печь, Посуда/столовые приборы, Электрическая плита",Парам,Залог,5,9,Панельный,1992,"Во двор, На улицу, Юг","Лифт, Мусоропровод, Стояночное место",Вторичное жилье,"Рафиева ул, 78, Минск",240 $ *,17 м²,-,Косметический,-,,-,,-,-,,
266,114499881,Центральный,,1,Долгосрочная,1,32.4 м²,5.3 м²,Совмещенный,Лоджия,Мебель,Душевая кабина,"Холодильник, Газовая плита",Парам,Месяц,4,5,Кирпичный,,Во двор,Домофон,Вторичное жилье,"Орловская ул, 31/2, Минск",250 $ *,18.7 м²,-,Без отделки,-,,-,-,-,-,,
267,114492361,Московский,Малиновка,1,Долгосрочная,,,,Раздельный,Есть,"Wi-Fi, Мебель",Стиральная машина,"Холодильник, Электрическая плита",,,,,Панельный,,,,Вторичное жилье,"Громова ул, 46, Минск",215 $ *,,,,,,,-,,,,
268,114019498,Фрунзенский,Каменная Горка,1,Долгосрочная,2,36.8 м²,5 м²,Раздельный,Есть,Мебель,,Электрическая плита,"С детьми, Студентам, Парам",Месяц,9,9,Монолитный,2014,"В парк, Юг","Лифт, Пандус, Домофон",Новое,"Нёманская ул, 3А, Минск",272 $ *,32 м²,,Евро,,,,,,,,
269,114439427,Фрунзенский,,1,Долгосрочная,,42.2 м²,8.1 м²,Совмещенный,Лоджия,"Wi-Fi, Телевизор, Телефон, Мебель",Стиральная машина,"Холодильник, СВЧ-печь, Посудомоечная машина, Электрическая плита",,Месяц,7,9,Кирпичный,2007,Во двор,"Лифт, Мусоропровод, Видеонаблюдение, Домофон",Вторичное жилье,"Притыцкого ул, 39, Минск",400 $ *,18 м²,,Евро,,Спортивная,,,,,,
270,114434720,Фрунзенский,Каменная Горка,1,Долгосрочная,2,43 м²,,Раздельный,Есть,"Wi-Fi, Телевизор, Утюг, Мебель","Душевая кабина, Стиральная машина, Комплект полотенец, Фен","Холодильник, СВЧ-печь, Посуда/столовые приборы, Газовая плита",Парам,Месяц,3,9,Панельный,2010,"Во двор, На улицу",,Вторичное жилье,"Нёманская ул, 37, Минск",400 $ *,30 м²,,Дизайнерский,,,,,,,,
271,114429979,Заводской,Шабаны,1,Долгосрочная,2,,,Раздельный,Есть,"Wi-Fi, Телевизор, Мебель",Стиральная машина,"Холодильник, СВЧ-печь, Газовая плита",,Месяц,8,9,,,,,Вторичное жилье,"Селицкого ул, 97, Минск",250 $ *,,,,,,,-,,,,
272,114430031,Заводской,,1,Долгосрочная,,,,Совмещенный,Нет,"Телевизор, Утюг, Мебель",Стиральная машина,"Холодильник, СВЧ-печь, Газовая плита","Студентам, С детьми, Командировочным, Рабочим, Парам",Месяц,1,5,Кирпичный,,"Во двор, Юг, Восток",Домофон,Вторичное жилье,"Жилуновича ул, 37, Минск",220 $ *,,-,Косметический,-,Партизанская,-,-,-,-,,
273,113382635,Заводской,,1,Долгосрочная,3,45 м²,11 м²,Раздельный,Лоджия,"Мебель, Wi-Fi",Стиральная машина,"Газовая плита, Посудомоечная машина, Холодильник","Командировочным, Рабочим, Парам, С животными, С детьми",Залог,2,5,Блочный,2010,"Во двор, Юг","Огороженная территория, Стояночное место, Домофон, Подвал",Вторичное жилье,"Крупской ул, Минск",310 $ *,33 м²,,Евро,Да,,,,,,,
274,114411668,Первомайский,Восток,1,Долгосрочная,,37 м²,9 м²,Раздельный,Лоджия,"Wi-Fi, Телевизор, Телефон, Утюг, Мебель",Стиральная машина,"Холодильник, Посуда/столовые приборы, Электрическая плита",,Залог,14,16,Панельный,1976,В парк,"Лифт, Мусоропровод, Домофон",Вторичное жилье,"Калиновского ул, 82к2, Минск",330 $ *,17 м²,-,Евро,-,Восток,-,-,-,-,,
275,114402109,Первомайский,,1,Долгосрочная,,43 м²,,Совмещенный,,,,,,,22,25,Монолитный,2016,,,Новое,"Кирилла Туровского ул, 14, Минск",500 $ *,38.2 м²,,Евро,,Восток,,,,,,
276,114395937,Центральный,Верхний город,1,Долгосрочная,,46.1 м²,11 м²,Совмещенный,,,,,,,2,4,Кирпичный,,,,Новое,"Городской Вал ул, 8, Минск",670 $ *,19.2 м²,,Дизайнерский,,Немига,,,,,,
277,113780706,Московский,,1,Долгосрочная,2,33 м²,,Совмещенный,Есть,"Wi-Fi, Утюг, Телевизор, Мебель","Комплект полотенец, Стиральная машина, Душевая кабина","Электрическая плита, Посуда/столовые приборы, СВЧ-печь, Холодильник",Парам,2 месяца,6,12,Монолитный,2017,В парк,"Лифт, Домофон",Новое,"Гурского ул, 41, Минск",320 $ *,33 м²,Да,Дизайнерский,Да,1,,,,,,
278,114378700,Первомайский,Уручье,1,Долгосрочная,2,35 м²,9 м²,Раздельный,Лоджия,"Телефон, Мебель, Телевизор, Wi-Fi",Стиральная машина,"Электрическая плита, Посуда/столовые приборы, СВЧ-печь, Холодильник",,Месяц,8,9,Панельный,1991,Во двор,"Лифт, Мусоропровод, Домофон",Вторичное жилье,"Никифорова ул, 17, Минск",310 $ *,18 м²,,Евро,,Уручье,,,,,,
279,114228022,Фрунзенский,Сухарево,1,Долгосрочная,2,32.7 м²,,Раздельный,Есть,Мебель,Стиральная машина,"Газовая плита, Холодильник",,Месяц,8,,Панельный,,Во двор,,Вторичное жилье,"Пимена Панченко ул, 14, Минск",233 $ *,,,,,,,,,,,
280,114368141,Заводской,,1,Долгосрочная,2,30 м²,8 м²,Совмещенный,Лоджия,"Телефон, Мебель, Телевизор",Стиральная машина,"Посуда/столовые приборы, Газовая плита, Холодильник",Парам,Залог,1,5,Панельный,,На улицу,,Вторичное жилье,"Васнецова ул, 8к1, Минск",220 $ *,15 м²,,Косметический,,Партизанская,,,,,,
281,114361666,Московский,Михалово,1,Долгосрочная,,40 м²,,Раздельный,Есть,"Wi-Fi, Мебель",Стиральная машина,"Холодильник, СВЧ-печь, Электрическая плита",Парам,Месяц,7,10,,2018,,"Лифт, Домофон, Видеонаблюдение",Вторичное жилье,"Михаловская ул, 4, Минск",250 $ *,,,,-,,,,,,,
282,114357601,Московский,,1,Долгосрочная,2,,,Совмещенный,Нет,"Телевизор, Мебель, Телефон",,"Холодильник, Газовая плита",,Месяц,1,,,,,,Вторичное жилье,"Коржа ул, 22, Минск",240 $ *,,,Косметический,,,,,,,,
283,114346608,Первомайский,Восток,1,Долгосрочная,,40 м²,7 м²,Раздельный,Лоджия,"Телефон, Мебель",Стиральная машина,"Холодильник, Газовая плита",Парам,Залог,7,9,,,,,Вторичное жилье,"Независимости пр, 125, Минск",310 $ *,23 м²,,,,Восток,,,,,,
284,114327996,Московский,Юго-Запад,1,Долгосрочная,2,,,Раздельный,Лоджия,"Мебель, Wi-Fi",Стиральная машина,Холодильник,,,,,Панельный,,,"Лифт, Мусоропровод, Домофон",Вторичное жилье,"Рафиева ул, 45, Минск",220 $ *,,,Косметический,,,,,,,,
